_id,restaurante_id,cardapio_id,nome,descricao,categoria,preco,fotos[0],ingredientes[0],ingredientes[1],ingredientes[2],ingredientes[3],ingredientes[4],ingredientes[5],ingredientes[6],ingredientes[7],informacoes_nutricionais.calorias,informacoes_nutricionais.proteinas,informacoes_nutricionais.carboidratos,informacoes_nutricionais.gorduras,opcoes_dieteticas[0],opcoes_dieteticas[1],destaque,promocao.ativo,promocao.preco_promocional,promocao.validade,disponivel,tempo_preparo,avaliacao_media,total_avaliacoes,data_criacao,ultima_atualizacao,alergenos[0],alergenos[1],alergenos[2]
683d8d05c709d34c0311e6bd,683d8d05c709d34c0311e492,683d8d05c709d34c0311e4c4,Incredible Bamboo Hat,Basium vestigium spoliatio abutor defetiscor thema vomer atqui. Dolorem sit contego vobis sursum. Provident nobis vereor alioqui vaco voluptatem vociferor repellendus thalassinus.,Sobremesa,34.43590755477389,https://loremflickr.com/2698/700/food?lock=6410791991801392,velut,ver,turbo,,,,,,1123,48,101,9,,,true,false,75.98253204497142,2025-08-14T23:16:08.296Z,true,26,3.000160227199841,183,2025-05-21T09:46:48.927Z,2025-02-10T03:30:36.384Z,lactose,,
683d8d05c709d34c0311e6c3,683d8d05c709d34c0311e492,683d8d05c709d34c0311e4c4,Handmade Concrete Pizza,Sufficio bonus cena utroque certe clarus. Comprehendo defluo nisi dignissimos deserunt supellex cresco. Collum alter calculus contra caritas degenero cunabula vado.,Bebida,110.84017711705324,https://loremflickr.com/1430/2540/food?lock=1977048995297205,dolor,solutio,advoco,adicio,ubi,,,,895,53,93,80,sem glúten,,false,false,96.8080317083981,2025-08-09T09:05:28.461Z,true,40,4.086626256307178,258,2024-05-31T12:29:52.798Z,2025-04-29T08:10:56.240Z,glúten,frutos do mar,ovos
683d8d05c709d34c0311e6cc,683d8d05c709d34c0311e492,683d8d05c709d34c0311e4c4,Incredible Rubber Shoes,Vulnus suadeo adeo solvo caelum virgo. Adfectus ara bene coniuratio tener suggero dedico arguo quae spero. Vespillo acervus sollicito cribro ager aeger thorax adsum abscido.,Prato Principal,34.62532249588058,https://loremflickr.com/1238/3932/food?lock=6071298340426364,aestus,bonus,aperte,adiuvo,candidus,cruentus,,,339,28,117,17,vegano,,false,false,20.018818305323677,2025-09-17T19:47:59.979Z,true,16,4.63981917589212,48,2023-10-11T00:43:12.849Z,2025-02-08T05:00:52.455Z,ovos,,
683d8d05c709d34c0311e6d6,683d8d05c709d34c0311e493,683d8d05c709d34c0311e4c5,Rustic Marble Bacon,Adimpleo advoco templum deleniti. Odio adduco asperiores creptio sufficio deinde. Contabesco aperiam caute.,Bebida,5.699513269809382,https://loremflickr.com/125/3217/food?lock=4745784703231855,aiunt,celo,crux,dens,ubi,antiquus,,,486,42,108,50,vegano,,true,false,17.554093527970707,2025-09-26T07:22:33.867Z,true,44,4.542404643692068,83,2025-01-23T18:43:47.262Z,2025-03-24T00:23:44.569Z,,,
683d8d05c709d34c0311e6d8,683d8d05c709d34c0311e493,683d8d05c709d34c0311e4c5,Electronic Concrete Hat,Distinctio numquam pecco necessitatibus adulescens. Possimus defluo depraedor calco conicio nihil. Adamo careo bos nostrum caterva cerno.,Entrada,9.412403449581632,https://loremflickr.com/3367/1431/food?lock=4051804834817630,vulnero,sub,sonitus,vigilo,ager,comedo,fugit,,983,61,41,69,,,false,false,75.69151659834132,2025-11-20T16:47:45.301Z,true,5,3.73100952029296,182,2025-02-06T16:46:10.580Z,2025-02-13T01:25:29.074Z,soja,,
683d8d05c709d34c0311e6db,683d8d05c709d34c0311e493,683d8d05c709d34c0311e4c5,Handmade Metal Ball,Cubo aspicio demens adicio vacuus sufficio spectaculum. Dolore aurum vinum acquiro vester ceno tandem. Debitis defaeco catena textus vacuus suus clarus.,Sobremesa,20.85860533074878,https://loremflickr.com/1125/3862/food?lock=7427849711306032,velit,defero,communis,suspendo,curia,,,,957,76,31,80,sem glúten,,false,false,93.12945866280374,2025-11-02T22:47:48.221Z,true,28,4.690169879198763,31,2024-12-12T01:26:49.452Z,2025-03-09T00:59:29.445Z,,,
683d8d05c709d34c0311e6dc,683d8d05c709d34c0311e493,683d8d05c709d34c0311e4c5,Elegant Bamboo Gloves,Vapulus adicio curriculum vereor ambitus vespillo super. Doloribus viscus decens amissio patrocinor crur iste. Tego cogo stipes dicta combibo alveus atque surgo.,Acompanhamento,115.01946593833422,https://loremflickr.com/3182/3830/food?lock=8065637806302963,vere,villa,sperno,arca,,,,,951,51,78,77,vegano,vegetariano,false,false,108.96034072236489,2025-10-24T17:15:09.361Z,true,10,4.57409653073689,215,2025-05-25T07:53:58.340Z,2025-05-05T09:59:18.446Z,soja,frutos do mar,amendoim
683d8d05c709d34c0311e6de,683d8d05c709d34c0311e493,683d8d05c709d34c0311e4c5,Soft Concrete Fish,Territo adstringo cogito vos baiulus nemo carcer. Campana capitulus tunc decerno dicta. Desipio avaritia beatus spes conor aptus.,Acompanhamento,23.26691069265113,https://loremflickr.com/1470/2884/food?lock=3910707271070758,approbo,est,balbus,,,,,,174,37,17,13,,,false,false,71.4349344548868,2025-11-19T15:25:41.587Z,true,20,4.259234669830335,192,2025-01-22T01:26:10.655Z,2025-02-10T17:20:46.480Z,glúten,,
683d8d05c709d34c0311e6ea,683d8d05c709d34c0311e494,683d8d05c709d34c0311e4c6,Oriental Steel Chair,Antiquus repellendus cito suasoria versus sollers aspernatur aspernatur comis. Veniam ago depulso. Cerno agnosco perspiciatis conspergo subnecto.,Acompanhamento,74.60298522350325,https://loremflickr.com/3548/3451/food?lock=4572283641841223,ver,cenaculum,demonstro,advenio,,,,,703,74,84,26,,,false,false,76.45742646003778,2025-11-15T02:24:33.111Z,true,6,2.3092677845143026,128,2024-07-31T16:21:53.894Z,2025-02-22T03:27:44.837Z,frutos do mar,,
683d8d05c709d34c0311e6ec,683d8d05c709d34c0311e494,683d8d05c709d34c0311e4c6,Handmade Plastic Chicken,Adipisci tibi ventus deprecator demonstro thema carpo bardus conservo textilis. Assentator clibanus corrumpo. Solum crux adaugeo dignissimos vapulus aestivus confugo anser.,Sobremesa,140.63382880671594,https://loremflickr.com/3283/1430/food?lock=4930863448361768,vitae,vulticulus,adhaero,,,,,,118,73,59,36,vegano,sem glúten,false,false,31.98090046723044,2025-08-30T09:36:56.686Z,true,37,3.6167259240035876,17,2025-05-08T03:45:43.634Z,2025-03-10T06:46:16.253Z,amendoim,,
683d8d05c709d34c0311e6ee,683d8d05c709d34c0311e494,683d8d05c709d34c0311e4c6,Elegant Ceramic Pizza,Conduco vester theatrum congregatio tantum alii ultio carpo tepidus aetas. Veritas adhuc vulticulus depereo ambitus doloribus. Conculco tripudio corroboro desidero aestas.,Acompanhamento,122.09084826577265,https://loremflickr.com/707/3446/food?lock=8983591282880421,minima,bonus,aggero,pauci,ea,,,,151,61,22,42,sem glúten,vegano,true,false,94.18467965537383,2025-07-13T17:56:00.153Z,true,27,3.3457263816824776,185,2024-12-23T17:39:15.607Z,2025-02-18T01:29:39.186Z,lactose,,
683d8d05c709d34c0311e6f1,683d8d05c709d34c0311e494,683d8d05c709d34c0311e4c6,Generic Aluminum Chicken,Sub consuasor desipio. Catena dolorum currus versus conqueror appositus absens deripio condico temporibus. Cimentarius culpa atrocitas deinde acervus ducimus comes arbor.,Acompanhamento,114.28286745743583,https://loremflickr.com/3435/81/food?lock=548286474301170,clamo,cubo,spes,agnosco,unde,addo,,,1141,12,24,63,,,false,false,81.11320963229315,2025-09-16T15:16:05.544Z,true,12,4.080796853575304,189,2025-01-30T14:05:20.504Z,2025-03-09T12:05:47.210Z,,,
683d8d05c709d34c0311e6f3,683d8d05c709d34c0311e494,683d8d05c709d34c0311e4c6,Fantastic Aluminum Pants,Calcar antepono alius. Crinis sumo cumque trans quo vesica caste. Aliquid decet repudiandae sunt.,Sobremesa,54.584548692619045,https://loremflickr.com/2734/498/food?lock=6266609454306771,stipes,amicitia,eum,vito,,,,,577,34,49,10,sem glúten,,false,false,42.94410683526144,2025-08-28T14:13:12.508Z,true,19,4.313910898487988,84,2025-03-01T14:23:21.751Z,2025-04-15T04:33:59.237Z,amendoim,,
683d8d05c709d34c0311e6fa,683d8d05c709d34c0311e494,683d8d05c709d34c0311e4c6,Ergonomic Steel Soap,Tutis demum articulus debilito aurum trepide. Talis adversus rerum beatae. Ante aequitas uter ventito tenuis cervus theatrum assumenda attero.,Acompanhamento,138.19985508269133,https://loremflickr.com/3487/3370/food?lock=3190551112216226,ipsam,tardus,cura,delectatio,usitas,texo,adinventitias,verbum,1119,57,87,37,,,false,false,35.46630356507183,2025-08-10T03:01:21.396Z,true,28,2.2073010015152392,246,2024-12-11T19:16:32.222Z,2025-04-16T15:39:14.216Z,,,
683d8d05c709d34c0311e6fd,683d8d05c709d34c0311e495,683d8d05c709d34c0311e4c7,Gorgeous Steel Gloves,Conservo circumvenio nisi tumultus. Alias vulgivagus cubitum dicta antiquus concido defero volo deprimo. Conventus desidero teneo.,Entrada,59.64723394874094,https://loremflickr.com/2033/2380/food?lock=8680983852357683,deripio,contabesco,peior,,,,,,397,67,86,88,,,false,false,112.1645443882675,2025-11-16T20:40:23.030Z,true,9,4.460800698162543,125,2023-09-26T00:06:27.195Z,2025-04-16T06:42:49.842Z,soja,glúten,frutos do mar
683d8d05c709d34c0311e702,683d8d05c709d34c0311e495,683d8d05c709d34c0311e4c7,Luxurious Aluminum Fish,Coadunatio comparo consequatur clarus aveho. Pectus corroboro angelus arca thesaurus volaticus. Suscipio conculco tam tabernus.,Acompanhamento,80.15153481069648,https://loremflickr.com/3133/1847/food?lock=6339996308283588,stillicidium,verbera,aufero,tamquam,vito,conatus,benevolentia,cariosus,430,73,96,86,,,false,false,58.43486858982585,2025-08-11T10:26:58.548Z,true,30,4.753910165639076,125,2024-06-04T18:26:16.465Z,2025-05-10T22:08:34.067Z,,,
683d8d05c709d34c0311e704,683d8d05c709d34c0311e495,683d8d05c709d34c0311e4c7,Oriental Rubber Sausages,Accusamus desolo utrum. Coadunatio adulatio comprehendo vilicus corporis iusto damno. Audeo dicta ullus decens cinis amaritudo.,Entrada,7.75613701929584,https://loremflickr.com/3295/263/food?lock=7082138608072890,defendo,supellex,desparatus,,,,,,570,40,129,43,,,false,false,118.47788952014312,2025-11-21T13:49:52.037Z,true,11,3.510862223719802,86,2024-12-01T08:01:35.077Z,2025-03-29T09:23:08.214Z,lactose,amendoim,glúten
683d8d05c709d34c0311e709,683d8d05c709d34c0311e496,683d8d05c709d34c0311e4c8,Luxurious Ceramic Chips,Adversus cogito infit venia eum utor tenetur. Turpis adfectus mollitia celer virtus verto volo fugit denuo. Vitiosus sufficio vilicus cernuus.,Sobremesa,92.9588057179662,https://loremflickr.com/2612/856/food?lock=6234739645122649,temporibus,sulum,vorax,cuius,,,,,119,14,147,34,sem glúten,vegano,false,false,102.51113043360628,2025-09-19T18:58:15.715Z,true,45,2.7318551175045673,295,2024-12-22T06:40:30.346Z,2025-04-28T04:06:04.840Z,soja,amendoim,glúten
683d8d05c709d34c0311e70a,683d8d05c709d34c0311e496,683d8d05c709d34c0311e4c8,Awesome Bamboo Ball,Aspicio alias degusto considero aliquam circumvenio toties thymbra vallum. Optio aspicio nam totus creo aperio velut totus curiositas. Quae triduana dolores depopulo stipes cohaero tergo quidem.,Acompanhamento,135.7365581294216,https://loremflickr.com/3620/3254/food?lock=4038859162419053,copia,nihil,vigilo,suus,vallum,,,,952,20,133,19,sem glúten,vegetariano,false,false,97.7973532213319,2025-07-09T18:45:50.210Z,true,8,3.7501523883849637,27,2024-08-19T19:05:11.380Z,2025-02-21T10:51:18.113Z,soja,lactose,amendoim
683d8d05c709d34c0311e70f,683d8d05c709d34c0311e496,683d8d05c709d34c0311e4c8,Handmade Gold Salad,Cultellus aedificium earum asperiores aegre tamdiu placeat aequus. Ulterius centum tam uberrime neque. Comptus conspergo porro adnuo cado aperio commodi.,Sobremesa,130.8901036737533,https://loremflickr.com/1918/315/food?lock=7276996271756588,textor,contego,varius,copiose,sequi,caput,,,582,38,66,24,vegano,sem glúten,false,false,4.7534582034771375,2025-08-03T01:43:46.076Z,true,18,3.496524102873875,56,2024-07-13T18:03:03.750Z,2025-05-03T23:44:41.393Z,frutos do mar,ovos,glúten
683d8d05c709d34c0311e71d,683d8d05c709d34c0311e497,683d8d05c709d34c0311e4c9,Modern Wooden Shoes,Attonbitus adipiscor comptus eos vel ceno. Substantia turpis commodo sollicito quisquam coerceo exercitationem. Tenax tutamen beneficium ultra.,Acompanhamento,111.89259840981148,https://loremflickr.com/243/2301/food?lock=5257692737083592,taedium,undique,trepide,sunt,damno,,,,321,65,110,29,vegetariano,sem glúten,false,false,48.62276259685286,2025-07-16T06:09:55.235Z,true,6,4.194178214162866,210,2023-06-13T20:13:51.943Z,2025-05-08T00:41:44.514Z,ovos,,
683d8d05c709d34c0311e723,683d8d05c709d34c0311e497,683d8d05c709d34c0311e4c9,Luxurious Wooden Hat,Ocer thermae demitto defaeco termes aurum vita autem. Candidus tristis quisquam caries vivo. Civis quo despecto angustus uterque molestias unus conservo.,Acompanhamento,74.40381076125784,https://loremflickr.com/2530/747/food?lock=5459372949902844,contabesco,cattus,amiculum,,,,,,699,22,68,25,vegano,vegetariano,false,false,47.61900058114055,2025-08-05T21:47:49.122Z,false,28,2.631743501003267,206,2023-11-14T16:49:21.338Z,2025-03-27T08:59:28.629Z,,,
683d8d05c709d34c0311e603,683d8d05c709d34c0311e487,683d8d05c709d34c0311e4b9,Small Granite Towels,Ademptio verbum triduana teneo urbs textilis cruentus inventore una. Comparo suppellex arceo decretum vobis sapiente. Bonus sufficio amita quibusdam vivo.,Prato Principal,139.51163957834885,https://loremflickr.com/3418/3330/food?lock=5328113023261361,decipio,neque,degero,,,,,,595,47,36,61,,,false,false,40.424716355522676,2025-06-27T04:19:56.638Z,true,6,3.5590780961892947,97,2023-12-18T23:45:49.936Z,2025-05-01T23:30:37.729Z,,,
683d8d05c709d34c0311e607,683d8d05c709d34c0311e487,683d8d05c709d34c0311e4b9,Handmade Steel Hat,Verbum ter atrox aestivus teres sustineo. Denuncio sursum delectatio vacuus asper videlicet. Ustilo deputo amor odio ut venio amiculum.,Sobremesa,89.85854506870572,https://loremflickr.com/1366/3351/food?lock=3321855404006813,somniculosus,video,tantum,atrox,necessitatibus,agnosco,aer,recusandae,625,39,104,47,sem glúten,vegano,false,false,68.21958900738647,2025-12-01T05:43:22.249Z,true,8,4.078288369532399,46,2023-12-20T12:14:50.936Z,2025-04-09T00:08:02.535Z,amendoim,ovos,glúten
683d8d05c709d34c0311e609,683d8d05c709d34c0311e487,683d8d05c709d34c0311e4b9,Handcrafted Wooden Shirt,Quibusdam nesciunt assumenda quisquam tondeo amplexus summisse. Ter ocer quidem infit aduro repellat tertius cito placeat stips. Doloremque ab ulciscor bellicus curia illo torqueo.,Entrada,67.50316758169916,https://loremflickr.com/739/745/food?lock=1212223997011744,unde,vergo,nulla,creta,,,,,126,41,149,45,vegano,,false,false,89.0766000137945,2025-06-18T05:27:27.090Z,true,45,3.9507712370669563,282,2025-02-06T20:46:09.952Z,2025-04-25T22:47:13.626Z,frutos do mar,soja,amendoim
683d8d05c709d34c0311e60b,683d8d05c709d34c0311e488,683d8d05c709d34c0311e4ba,Incredible Aluminum Tuna,Venustas vulgaris tactus. Stips talus torqueo corroboro alius defleo. Arx asperiores comedo vesica convoco viriliter talus aequitas amissio impedit.,Acompanhamento,107.5015181413147,https://loremflickr.com/2729/444/food?lock=1533040112225865,adsuesco,claro,villa,certus,asper,vox,,,203,7,38,78,sem glúten,,false,false,5.914069149657752,2025-06-02T12:38:55.998Z,true,44,2.263997724014397,266,2024-11-10T07:46:18.367Z,2025-03-21T01:44:47.133Z,ovos,frutos do mar,
683d8d05c709d34c0311e610,683d8d05c709d34c0311e488,683d8d05c709d34c0311e4ba,Gorgeous Aluminum Pizza,Absconditus advoco venia averto sequi molestiae doloribus. Curtus creo a super canto suffragium vito cometes aggero conatus. Derelinquo deleniti condico.,Acompanhamento,95.51733325027774,https://loremflickr.com/2836/3527/food?lock=5516226983204804,caste,suggero,caste,voluptas,,,,,933,34,105,52,vegetariano,,false,false,116.95177007238932,2025-08-05T09:52:12.616Z,true,13,2.4872645877128328,54,2024-01-11T20:11:16.737Z,2025-02-17T09:30:49.892Z,lactose,soja,
683d8d05c709d34c0311e611,683d8d05c709d34c0311e488,683d8d05c709d34c0311e4ba,Oriental Ceramic Ball,Sophismata veritatis aveho. Quisquam demo adhuc vesco non tracto surculus amplexus. Adnuo peior depromo solitudo animi summa.,Entrada,134.2729073123016,https://loremflickr.com/1619/1215/food?lock=4210896515137398,arcus,sollicito,ambulo,acidus,,,,,432,53,24,29,,,false,false,102.08203067640414,2025-08-27T23:09:04.440Z,true,12,4.282541638416001,109,2024-06-08T04:24:01.138Z,2025-05-23T00:52:08.063Z,lactose,frutos do mar,ovos
683d8d05c709d34c0311e615,683d8d05c709d34c0311e488,683d8d05c709d34c0311e4ba,Elegant Bronze Pants,Perspiciatis campana celebrer campana talus adflicto asperiores quisquam. Patrocinor decipio adsidue patior trepide. Doloremque constans decimus ademptio accendo dedecor triumphus.,Bebida,144.6381571141569,https://loremflickr.com/1397/2963/food?lock=5657973629577579,terebro,torrens,canonicus,aggredior,thesis,acerbitas,,,844,63,86,19,,,false,false,67.04570085614229,2025-09-12T16:27:12.551Z,false,32,2.160954488815385,98,2023-07-13T08:25:16.828Z,2025-04-13T23:21:36.081Z,,,
683d8d05c709d34c0311e619,683d8d05c709d34c0311e489,683d8d05c709d34c0311e4bb,Rustic Wooden Car,Vitae expedita absconditus subiungo explicabo. Repellendus demens explicabo caute sonitus. Inflammatio aspernatur sonitus rem suggero vesica virtus.,Prato Principal,86.97726494675443,https://loremflickr.com/1094/3626/food?lock=3926528372452836,amitto,sunt,aqua,totam,cupiditas,,,,213,69,59,23,,,false,false,118.52335237163544,2025-07-05T13:44:05.964Z,true,41,4.861375496887059,236,2025-01-19T22:34:25.375Z,2025-06-02T06:57:13.125Z,amendoim,,
683d8d05c709d34c0311e61c,683d8d05c709d34c0311e489,683d8d05c709d34c0311e4bb,Oriental Metal Car,Crepusculum unus ab facere taedium. Vox pecco suspendo verbum spes conforto somniculosus ullus adsuesco. Ara cuppedia ars synagoga cinis cupiditate.,Entrada,105.17913258243925,https://loremflickr.com/882/697/food?lock=7287309732985874,adamo,facere,quas,adimpleo,hic,labore,thermae,,781,20,15,55,,,false,false,54.08959988001646,2025-11-23T01:03:46.177Z,true,22,4.16676180023766,217,2024-07-30T12:11:25.637Z,2025-03-20T18:47:30.498Z,frutos do mar,amendoim,
683d8d05c709d34c0311e622,683d8d05c709d34c0311e489,683d8d05c709d34c0311e4bb,Frozen Bronze Sausages,Canonicus depopulo placeat decumbo xiphias ventito eum decet ter voluptatibus. Defluo commemoro carbo universe capitulus theologus deputo. Solus clamo aeternus dolores.,Bebida,147.70644191180995,https://loremflickr.com/2151/2942/food?lock=3195426008778536,campana,subito,arto,,,,,,255,74,108,64,,,false,false,74.58791044470934,2025-09-29T20:24:53.318Z,true,21,2.2303646910086266,266,2023-12-20T17:57:25.333Z,2025-04-14T23:52:48.824Z,frutos do mar,,
683d8d05c709d34c0311e62a,683d8d05c709d34c0311e48a,683d8d05c709d34c0311e4bc,Practical Bamboo Tuna,Decretum quis acies decor peccatus absconditus triduana paens. Ulciscor aveho deporto vestrum utique. Cultellus apud vis tepesco.,Prato Principal,114.0742773907087,https://loremflickr.com/3939/3418/food?lock=5368034236878621,vorax,vis,credo,cultellus,carus,,,,290,69,111,46,sem glúten,vegetariano,false,false,96.1485573880985,2025-07-01T05:19:09.962Z,true,10,4.940128091085322,214,2024-07-15T07:49:41.500Z,2025-04-26T21:32:59.823Z,lactose,,
683d8d05c709d34c0311e62c,683d8d05c709d34c0311e48a,683d8d05c709d34c0311e4bc,Tasty Wooden Salad,Peccatus admitto ademptio umbra dolores decumbo alveus. Casus spargo quisquam ara cattus creptio pauci conor. Alias umerus adamo cito.,Acompanhamento,148.8035938406773,https://loremflickr.com/842/3219/food?lock=8931097891392461,sequi,ustilo,caritas,utilis,,,,,1046,73,17,32,vegetariano,vegano,false,false,89.38626756356729,2025-06-05T15:52:40.542Z,false,31,2.6777012105143014,176,2025-03-24T06:53:38.646Z,2025-05-30T13:38:43.142Z,,,
683d8d05c709d34c0311e633,683d8d05c709d34c0311e48a,683d8d05c709d34c0311e4bc,Fantastic Cotton Pizza,Unde patruus vinco audeo cunabula triumphus attero. Chirographum adsum stabilis. Vorax avarus pecco ambulo maiores verto.,Prato Principal,148.4721230975833,https://loremflickr.com/3430/2701/food?lock=6881580530921356,tonsor,compello,adeptio,vos,colligo,theatrum,adhaero,,123,24,50,9,,,false,false,55.29469024880581,2025-09-19T18:13:06.363Z,true,31,3.8771942178500773,87,2024-01-26T13:49:37.560Z,2025-03-27T04:16:24.380Z,,,
683d8d05c709d34c0311e634,683d8d05c709d34c0311e48a,683d8d05c709d34c0311e4bc,Small Steel Chips,Paens tamdiu ex necessitatibus soleo commodi quia nisi. Virgo taedium demulceo. Adopto accusamus cuppedia somniculosus sortitus vivo succedo summa theca.,Sobremesa,13.781163887888443,https://loremflickr.com/794/1202/food?lock=2549013911593663,aspicio,solium,speciosus,uter,curo,accommodo,,,592,55,149,51,vegetariano,,true,false,93.47145188288127,2025-09-20T03:31:58.009Z,true,21,2.654378627044447,59,2024-02-23T04:50:23.571Z,2025-03-17T21:30:31.405Z,lactose,soja,amendoim
683d8d05c709d34c0311e638,683d8d05c709d34c0311e48a,683d8d05c709d34c0311e4bc,Luxurious Silk Soap,Cursim vero tergiversatio studio adamo creator eligendi confero cunae. Debeo cui aro aggero demitto distinctio aggero. Admoveo advoco cursim voluptatem.,Entrada,149.76718216567673,https://loremflickr.com/3180/1021/food?lock=2418382480201215,adipiscor,crux,doloremque,artificiose,succurro,,,,954,24,113,7,,,false,false,47.007583648617846,2025-11-25T01:53:34.392Z,true,30,3.617069339771424,110,2025-05-22T14:41:52.326Z,2025-03-02T06:58:45.582Z,soja,ovos,
683d8d05c709d34c0311e63c,683d8d05c709d34c0311e48b,683d8d05c709d34c0311e4bd,Licensed Steel Keyboard,Verumtamen vociferor contigo suadeo placeat dignissimos adficio. Deficio creta clementia attollo tardus. Peior succurro defero vir vapulus absum pecto.,Entrada,105.48715207317083,https://loremflickr.com/2562/2652/food?lock=3944519617195387,tondeo,tolero,deficio,subnecto,rem,,,,215,51,136,79,,,false,false,117.44599803424762,2025-11-13T11:06:42.708Z,true,21,2.7052356014041097,136,2024-02-18T23:36:22.255Z,2025-05-16T10:35:20.056Z,,,
683d8d05c709d34c0311e643,683d8d05c709d34c0311e48b,683d8d05c709d34c0311e4bd,Frozen Bronze Ball,Arguo considero comminor itaque umerus ceno. Harum spiculum patrocinor tyrannus delego valens sit venio concedo. Arca vilicus coadunatio terminatio vel ultra.,Acompanhamento,14.028568509567595,https://loremflickr.com/3667/2492/food?lock=7138031719969420,talus,amaritudo,atque,distinctio,verbum,at,quis,vilis,462,33,51,43,vegetariano,,false,false,119.94704121511982,2025-06-12T05:56:18.521Z,true,37,3.1682648979220294,81,2023-11-24T01:18:21.186Z,2025-03-16T11:58:59.155Z,glúten,,
683d8d05c709d34c0311e65c,683d8d05c709d34c0311e48d,683d8d05c709d34c0311e4bf,Luxurious Ceramic Ball,Aliqua una sortitus paulatim audacia. Adulatio ascisco ulterius caelestis utroque eos. Sollers nam sonitus contigo quas.,Bebida,20.601034596389233,https://loremflickr.com/99/2481/food?lock=315637067998805,summa,decretum,surgo,ater,,,,,1111,69,35,90,,,true,false,68.6659973904225,2025-07-24T12:32:39.881Z,true,24,3.7499771982262136,271,2025-03-30T16:51:19.048Z,2025-05-20T21:57:53.356Z,glúten,lactose,
683d8d05c709d34c0311e65f,683d8d05c709d34c0311e48d,683d8d05c709d34c0311e4bf,Intelligent Ceramic Fish,Adimpleo contego voluptates vigilo aegrus soleo maiores alioqui adipisci. Magnam sonitus spiritus. Dolorum attero desino vae supellex esse super voluptas.,Acompanhamento,47.63245444148403,https://loremflickr.com/2667/663/food?lock=4775036890902046,cur,communis,suscipio,textor,,,,,353,38,58,55,sem glúten,vegano,false,false,63.923648810045634,2025-11-29T01:06:21.317Z,true,22,4.372197420231507,9,2025-02-23T11:07:05.960Z,2025-03-27T10:59:35.510Z,lactose,frutos do mar,soja
683d8d05c709d34c0311e668,683d8d05c709d34c0311e48d,683d8d05c709d34c0311e4bf,Ergonomic Ceramic Car,Spero ullus coniecto crebro coniuratio argumentum aestus acidus. Adhaero utor apto sulum vulgivagus demitto hic cohibeo desolo. Vado curvo somnus suspendo amitto voro antiquus vociferor via.,Entrada,139.38509145393184,https://loremflickr.com/2386/2222/food?lock=692414181694958,adamo,rerum,solutio,vado,caput,congregatio,conforto,doloremque,718,9,114,43,,,false,false,53.73712985749981,2025-11-20T06:12:52.182Z,true,8,2.253634602308795,103,2024-05-09T23:55:30.009Z,2025-02-17T14:46:41.471Z,,,
683d8d05c709d34c0311e66b,683d8d05c709d34c0311e48d,683d8d05c709d34c0311e4bf,Licensed Metal Hat,Clamo tendo demo statim thesis viduo omnis suggero umbra. Volo cerno dedecor baiulus vulticulus tum unus. Volutabrum torrens curis nobis accusamus velut vester quia thymbra.,Bebida,77.44303735495801,https://loremflickr.com/2695/3755/food?lock=7052287178504913,verumtamen,eum,dolor,capio,,,,,853,41,11,17,sem glúten,vegano,true,false,33.480240152929504,2025-09-08T16:46:14.643Z,false,39,3.616904772995466,164,2023-11-19T17:59:08.112Z,2025-02-24T10:03:27.006Z,glúten,ovos,soja
683d8d05c709d34c0311e674,683d8d05c709d34c0311e48e,683d8d05c709d34c0311e4c0,Unbranded Rubber Cheese,Animadverto occaecati impedit crinis cunctatio sufficio crastinus accendo placeat. Conscendo argentum tristis virtus ara ceno coma audeo aqua trepide. Vitiosus dicta deficio.,Bebida,71.24805217944086,https://loremflickr.com/1479/1030/food?lock=5300397054782964,eligendi,uredo,nam,,,,,,367,39,30,81,,,false,false,84.80506909273932,2025-09-03T12:50:27.538Z,true,40,3.0081272765922225,215,2025-04-18T22:24:43.127Z,2025-05-11T05:37:29.633Z,,,
683d8d05c709d34c0311e676,683d8d05c709d34c0311e48e,683d8d05c709d34c0311e4c0,Modern Wooden Shirt,Tabella terebro veritas. Amicitia volo amo velit suasoria animus ulciscor. Corrigo arma tyrannus toties.,Prato Principal,103.79029594669935,https://loremflickr.com/3314/2300/food?lock=3945889759456555,crudelis,cur,accusamus,thymbra,,,,,400,44,31,27,vegano,,true,false,42.783618814135004,2025-09-19T10:11:24.457Z,true,33,3.0202136582988817,63,2023-08-12T14:57:27.522Z,2025-05-15T13:12:53.144Z,,,
683d8d05c709d34c0311e677,683d8d05c709d34c0311e48e,683d8d05c709d34c0311e4c0,Handmade Concrete Mouse,Tabella cimentarius voluptates decumbo capitulus claro aufero paulatim astrum perferendis. Demo coepi neque canonicus sto torqueo vero. Utroque eum alius decerno cimentarius vesco clibanus crustulum comparo patior.,Sobremesa,73.01621797279283,https://loremflickr.com/402/103/food?lock=5178866716536404,tendo,depromo,temporibus,strenuus,caveo,debilito,,,931,41,136,16,sem glúten,,false,false,41.396082357402456,2025-09-02T07:44:20.767Z,true,38,2.805947537542853,222,2023-09-01T06:46:10.314Z,2025-04-10T16:25:30.840Z,glúten,amendoim,
