_id,restaurante_id,cardapio_id,nome,descricao,categoria,preco,fotos[0],ingredientes[0],ingredientes[1],ingredientes[2],ingredientes[3],ingredientes[4],ingredientes[5],ingredientes[6],ingredientes[7],informacoes_nutricionais.calorias,informacoes_nutricionais.proteinas,informacoes_nutricionais.carboidratos,informacoes_nutricionais.gorduras,opcoes_dieteticas[0],opcoes_dieteticas[1],destaque,promocao.ativo,promocao.preco_promocional,promocao.validade,disponivel,tempo_preparo,avaliacao_media,total_avaliacoes,data_criacao,ultima_atualizacao,alergenos[0],alergenos[1],alergenos[2]
683d8d05c709d34c0311e57f,683d8d05c709d34c0311e47f,683d8d05c709d34c0311e4b1,Luxurious Cotton Soap,Suasoria venia textus acerbitas vomer advenio solio sodalitas. Acquiro ducimus ater tristis thymum viridis vinculum vesper. Tardus conqueror aeger eius.,Acompanhamento,93.18496581983545,https://loremflickr.com/927/430/food?lock=8105739560646547,blandior,balbus,adhaero,summa,thymbra,nihil,aureus,,398,50,67,24,sem glúten,,false,false,39.19434218136317,2025-09-21T23:07:48.748Z,true,34,3.243167247481785,198,2023-09-19T10:07:35.594Z,2025-04-11T02:28:55.709Z,frutos do mar,,
683d8d05c709d34c0311e581,683d8d05c709d34c0311e47f,683d8d05c709d34c0311e4b1,Modern Gold Gloves,Soluta vitae defluo aestas. Barba fugiat stipes comparo. Accendo cernuus caelum bene acsi amplus.,Acompanhamento,46.92941597740879,https://loremflickr.com/2092/2589/food?lock=905600075502874,stillicidium,amissio,adopto,spero,territo,taceo,,,1160,18,143,17,sem glúten,,false,false,117.7119502696848,2025-10-04T02:41:54.369Z,true,32,4.228760306530386,81,2023-08-13T08:09:58.146Z,2025-05-03T07:14:58.994Z,ovos,,
683d8d05c709d34c0311e583,683d8d05c709d34c0311e480,683d8d05c709d34c0311e4b2,Gorgeous Marble Shirt,Crustulum ara vestrum velut coerceo acervus solvo. Adicio pax vacuus tertius comparo totus. Urbs claudeo balbus callide ratione careo currus tamquam sit.,Sobremesa,99.43977094450997,https://loremflickr.com/2264/1025/food?lock=4032538388627538,harum,clibanus,cervus,triduana,,,,,1174,64,22,88,vegano,vegetariano,true,false,5.615941290633783,2025-11-29T16:42:11.232Z,true,11,3.3374824772273977,238,2024-05-25T23:41:18.120Z,2025-05-22T21:20:50.482Z,soja,,
683d8d05c709d34c0311e586,683d8d05c709d34c0311e480,683d8d05c709d34c0311e4b2,Frozen Bamboo Car,Abeo depromo corrigo. Comptus sursum tertius damno molestias. Bonus asper tredecim agnitio capio.,Bebida,76.70166144873289,https://loremflickr.com/1809/753/food?lock=8226976831240639,id,caute,tyrannus,umbra,in,viridis,angelus,delicate,543,57,94,51,,,false,false,29.057404304940533,2025-07-20T04:55:11.049Z,true,26,4.5219041891877225,250,2024-04-26T15:48:41.558Z,2025-04-07T17:28:02.644Z,,,
683d8d05c709d34c0311e58f,683d8d05c709d34c0311e480,683d8d05c709d34c0311e4b2,Licensed Concrete Salad,Vox sint amitto. Decimus absque subvenio perspiciatis deduco. Dicta veniam deserunt tener ater spiritus socius ea acceptus.,Prato Principal,69.8531833337614,https://loremflickr.com/166/1086/food?lock=8211644324169918,vae,architecto,cura,asperiores,coerceo,confido,,,1074,23,144,31,vegetariano,,false,true,57.68613119318371,2025-11-08T13:41:06.159Z,true,13,2.9999948710328574,123,2023-10-01T01:59:08.965Z,2025-05-11T02:54:23.697Z,lactose,ovos,soja
683d8d05c709d34c0311e591,683d8d05c709d34c0311e480,683d8d05c709d34c0311e4b2,Electronic Steel Pants,Patior tardus dens sol somnus. Acies considero pecco creo volubilis defero nisi comis. Villa benevolentia decumbo abbas tergum absconditus atrox arma temptatio acies.,Acompanhamento,19.388293822971555,https://loremflickr.com/604/2193/food?lock=206249477960336,cribro,barba,deporto,cura,sapiente,vindico,solium,adulescens,539,17,39,21,vegetariano,vegano,false,false,44.65597721562018,2025-08-25T10:30:52.472Z,true,35,2.9486840939754124,113,2025-05-26T21:08:21.015Z,2025-03-05T03:43:53.183Z,glúten,ovos,
683d8d05c709d34c0311e593,683d8d05c709d34c0311e480,683d8d05c709d34c0311e4b2,Small Cotton Cheese,Alienus vito vae amicitia sonitus vitiosus coerceo adversus casso. Callide taceo illo appello desparatus thymbra suffragium. Uxor sint vulnus vorago accommodo aduro vomito dolorem sperno iusto.,Prato Principal,78.09803634844891,https://loremflickr.com/3257/1979/food?lock=6344853907881328,tantillus,creptio,tutis,harum,damnatio,omnis,audentia,verumtamen,458,75,105,39,,,false,false,10.798088780076451,2025-06-29T16:12:53.951Z,true,45,2.786805897995477,174,2024-06-14T06:23:45.374Z,2025-02-15T04:44:46.260Z,soja,,
683d8d05c709d34c0311e59f,683d8d05c709d34c0311e481,683d8d05c709d34c0311e4b3,Unbranded Ceramic Sausages,Non velit tergo sui caute tergiversatio cotidie assentator vergo suggero. Succedo aut vomica deorsum vito calco culpa thesis ater dolor. Aeneus caste versus absconditus adfectus derelinquo.,Prato Principal,29.36180762264671,https://loremflickr.com/2419/3933/food?lock=6942313493298147,condico,acidus,vae,voco,accendo,viscus,alter,somniculosus,186,17,110,59,vegano,,false,true,44.73445834531233,2025-08-30T07:33:13.910Z,true,20,3.2548787184733508,235,2024-06-27T12:29:17.757Z,2025-05-21T09:24:44.473Z,ovos,lactose,soja
683d8d05c709d34c0311e5a3,683d8d05c709d34c0311e481,683d8d05c709d34c0311e4b3,Incredible Rubber Gloves,Voluptatum ea curis. Apparatus correptius currus eos decet apostolus labore patria cariosus. Comitatus tam angustus.,Sobremesa,110.23045767644173,https://loremflickr.com/3320/2058/food?lock=4206409654030275,vito,pariatur,arceo,clarus,sodalitas,,,,876,15,118,37,,,false,false,118.40148423369385,2025-11-13T00:14:46.039Z,true,35,4.470841744798641,247,2024-08-12T06:10:45.125Z,2025-04-01T09:55:42.445Z,ovos,glúten,
683d8d05c709d34c0311e5a6,683d8d05c709d34c0311e482,683d8d05c709d34c0311e4b4,Incredible Silk Towels,Odit ventosus totus eius hic cervus ex. Sopor accusator temptatio sperno eius. Nostrum utor utroque.,Bebida,38.398994044817435,https://loremflickr.com/719/3474/food?lock=1083397571870098,benevolentia,tantillus,crur,vero,,,,,705,32,28,90,,,false,true,9.103768296887322,2025-06-24T14:04:38.351Z,true,34,3.9362329203137607,271,2024-06-29T17:36:30.907Z,2025-02-03T01:19:03.729Z,soja,glúten,
683d8d05c709d34c0311e5a7,683d8d05c709d34c0311e482,683d8d05c709d34c0311e4b4,Oriental Concrete Towels,Decor victus vigilo acquiro caelestis conicio. Conor denuncio abscido ater tergiversatio. Cruciamentum alioqui adflicto quas sodalitas vox thesaurus ulciscor advoco carmen.,Sobremesa,147.78835187979215,https://loremflickr.com/2836/959/food?lock=4997397460569461,audax,accendo,cruciamentum,spes,cedo,venustas,,,379,76,92,80,sem glúten,,false,false,100.13691015798756,2025-08-14T21:22:28.011Z,true,22,4.118799061374469,216,2024-10-06T18:24:53.979Z,2025-04-01T10:29:06.298Z,soja,lactose,glúten
683d8d05c709d34c0311e5aa,683d8d05c709d34c0311e482,683d8d05c709d34c0311e4b4,Fantastic Granite Salad,Amaritudo vis tricesimus corrigo aequitas. Adinventitias vox volup denuo tenus aggero adnuo. Ascit carbo vorago venustas tenax suscipit antea tendo sulum ipsum.,Bebida,136.39135002935635,https://loremflickr.com/2584/2957/food?lock=8638261610705656,iure,comminor,at,caterva,,,,,1104,27,77,28,,,false,false,87.02264844181083,2025-08-20T02:24:08.215Z,true,37,4.35683770233845,292,2024-02-24T07:13:36.337Z,2025-02-21T10:20:51.380Z,frutos do mar,lactose,ovos
683d8d05c709d34c0311e5ac,683d8d05c709d34c0311e482,683d8d05c709d34c0311e4b4,Fantastic Granite Shoes,Tempora magni sophismata voro candidus. Quam curiositas ustilo aequitas congregatio cultellus adhuc conduco veritatis consectetur. Deleo vestigium spargo depopulo defessus.,Prato Principal,56.152582092982044,https://loremflickr.com/3086/7/food?lock=7338781399190314,vorago,tremo,spes,debilito,xiphias,animadverto,,,888,79,62,76,sem glúten,vegano,false,false,81.13666286248095,2025-11-09T16:42:12.656Z,true,28,2.769470650111228,286,2024-01-30T01:18:13.343Z,2025-02-23T05:29:53.364Z,amendoim,ovos,
683d8d05c709d34c0311e5b3,683d8d05c709d34c0311e482,683d8d05c709d34c0311e4b4,Electronic Plastic Pizza,Comparo adhuc terra vitiosus congregatio colo theca contra compello. Tandem vulgo pecto vergo speciosus copiose amplitudo. Claudeo deserunt crapula terga attollo.,Entrada,72.65319992682622,https://loremflickr.com/3396/3575/food?lock=3920475154438893,teneo,voluptatem,civis,carbo,,,,,1086,73,22,20,vegetariano,,false,false,118.3597351537827,2025-12-01T16:15:10.723Z,true,22,2.817393977742478,109,2023-07-08T23:13:33.709Z,2025-05-07T06:05:11.923Z,glúten,,
683d8d05c709d34c0311e5b8,683d8d05c709d34c0311e483,683d8d05c709d34c0311e4b5,Intelligent Wooden Shirt,Suggero vilicus comburo defluo. Sequi admiratio spargo tabernus bellicus. Pecco amplexus quasi comprehendo cribro anser sortitus conculco corrigo.,Entrada,44.7997492704193,https://loremflickr.com/868/1538/food?lock=3942165202662259,dolor,suasoria,baiulus,totidem,circumvenio,terga,,,1110,60,40,12,vegano,,false,false,22.22115619322458,2025-07-08T21:33:36.635Z,true,14,2.9659360890235416,41,2024-04-20T06:21:10.619Z,2025-05-31T06:55:25.792Z,,,
683d8d05c709d34c0311e5bb,683d8d05c709d34c0311e483,683d8d05c709d34c0311e4b5,Refined Wooden Bacon,Atrocitas thymum coniecto paens spectaculum deludo ago creo denuo. Vulticulus demens capitulus. Stabilis copia terebro quia suasoria cohibeo.,Prato Principal,91.86313130844563,https://loremflickr.com/710/886/food?lock=6409210562136548,vulnus,reprehenderit,aequus,circumvenio,tabesco,sumptus,arca,bos,952,34,48,83,vegetariano,,false,false,33.26252014387147,2025-10-25T07:49:29.165Z,true,18,2.6503320097905116,110,2024-09-11T02:31:16.106Z,2025-04-24T10:22:07.217Z,frutos do mar,,
683d8d05c709d34c0311e5c0,683d8d05c709d34c0311e484,683d8d05c709d34c0311e4b6,Frozen Steel Salad,Pauper abutor aduro illo natus ratione. Tempus possimus bene clibanus sulum villa suus adversus valeo conforto. Amplexus surgo solium coadunatio vinitor tabgo umquam.,Entrada,49.04563416926315,https://loremflickr.com/3384/3022/food?lock=2774153027042786,cotidie,asporto,arto,,,,,,380,65,112,20,vegano,,false,false,37.78750196491256,2025-09-26T17:01:14.712Z,true,8,4.598869356469215,194,2024-08-04T10:26:52.800Z,2025-05-08T14:05:13.487Z,soja,glúten,frutos do mar
683d8d05c709d34c0311e5c3,683d8d05c709d34c0311e484,683d8d05c709d34c0311e4b6,Luxurious Silk Chair,Stultus amo denuo undique socius addo suasoria. Odit teneo confido alioqui aliquam celebrer defaeco delectus. Ver valde degenero patruus versus vir bos abeo.,Entrada,21.22082246542136,https://loremflickr.com/3662/1237/food?lock=1646527258899284,dens,absum,acer,aut,viriliter,,,,479,70,129,35,sem glúten,,false,false,59.245693092075335,2025-07-27T02:00:10.435Z,true,36,2.2513434629312625,195,2023-08-10T12:05:16.572Z,2025-05-26T13:37:03.733Z,amendoim,soja,
683d8d05c709d34c0311e5c5,683d8d05c709d34c0311e484,683d8d05c709d34c0311e4b6,Refined Granite Pizza,Casso stillicidium somnus certe. Confugo tum natus. Optio sufficio allatus ulterius.,Sobremesa,93.30145933065913,https://loremflickr.com/1597/2717/food?lock=2101086113340507,statim,carcer,cultura,bonus,arcus,ad,aliquid,,1097,59,65,14,vegano,,false,false,27.272829757379423,2025-07-15T14:14:36.573Z,true,40,2.5955539425912004,205,2024-06-27T09:54:41.844Z,2025-05-16T08:33:48.373Z,,,
683d8d05c709d34c0311e5c8,683d8d05c709d34c0311e484,683d8d05c709d34c0311e4b6,Unbranded Wooden Chicken,Quos commodo dolore caritas civitas consequuntur. Stillicidium coniecto paens unde claustrum amaritudo anser caries vulgivagus coaegresco. Tamisium comburo eos canto thesis at civis.,Acompanhamento,94.73085503257686,https://loremflickr.com/1277/2695/food?lock=2125341864943422,clamo,angelus,distinctio,caterva,desparatus,amoveo,admiratio,,1093,67,38,48,vegetariano,sem glúten,false,false,110.13767960211158,2025-11-10T14:26:01.555Z,true,5,4.347439900364388,30,2023-08-08T13:58:51.494Z,2025-02-04T20:35:32.074Z,,,
683d8d05c709d34c0311e5cb,683d8d05c709d34c0311e484,683d8d05c709d34c0311e4b6,Awesome Bronze Table,Celer adipiscor vicinus attollo contabesco patior bene suffoco astrum aeneus. Tempus aureus corrumpo cogito pectus. Conservo cinis sono subvenio laboriosam.,Sobremesa,116.8110536322863,https://loremflickr.com/3337/802/food?lock=8614520070976489,repudiandae,suasoria,solitudo,degero,,,,,970,19,70,46,vegetariano,vegano,false,false,73.23891761208793,2025-06-03T19:47:37.731Z,true,45,3.6007841617477956,196,2024-09-15T19:29:27.412Z,2025-04-12T19:08:12.839Z,,,
683d8d05c709d34c0311e5cc,683d8d05c709d34c0311e484,683d8d05c709d34c0311e4b6,Incredible Granite Towels,Uredo tolero quasi usitas vespillo dolor alius communis. Derelinquo bardus vae acer color strues thermae illum. Debitis est assumenda apostolus.,Bebida,6.516388960476747,https://loremflickr.com/2678/2028/food?lock=766387629346408,aer,eos,nihil,terebro,cupressus,maiores,talis,depulso,464,66,45,16,vegano,,false,false,39.19208025066146,2025-09-21T06:20:45.939Z,false,21,3.257905021328374,272,2025-04-05T23:21:44.396Z,2025-05-15T09:10:43.649Z,frutos do mar,glúten,
683d8d05c709d34c0311e5cf,683d8d05c709d34c0311e484,683d8d05c709d34c0311e4b6,Small Granite Sausages,Viscus speculum delego vindico suscipit et calamitas dolores capto. Crinis caste tenetur tamen laborum utor solium. Umquam temptatio adhaero creber cupressus arcus adflicto.,Entrada,80.12391216421553,https://loremflickr.com/1330/3076/food?lock=4232955481037698,tubineus,sulum,vetus,,,,,,642,75,20,10,,,false,false,92.32047278532663,2025-11-01T20:14:27.025Z,true,28,2.7419534766905183,116,2024-09-02T04:10:53.126Z,2025-03-17T02:29:38.814Z,ovos,amendoim,
683d8d05c709d34c0311e5d4,683d8d05c709d34c0311e485,683d8d05c709d34c0311e4b7,Modern Cotton Keyboard,Adicio universe blandior suus enim alioqui utique statim abbas soluta. Una deinde suppellex socius advoco. Tempore valeo terror.,Entrada,62.00146150232412,https://loremflickr.com/3936/960/food?lock=8193190528250971,spoliatio,sophismata,terebro,eveniet,copiose,venio,ustulo,,1087,41,80,67,sem glúten,vegano,false,false,12.145500963563538,2025-08-17T11:35:22.007Z,true,33,2.9104007351495986,145,2024-04-23T14:19:07.647Z,2025-05-12T02:30:15.145Z,lactose,frutos do mar,glúten
683d8d05c709d34c0311e5db,683d8d05c709d34c0311e485,683d8d05c709d34c0311e4b7,Fantastic Ceramic Computer,Vomito torqueo suffoco. Strues soleo uberrime reprehenderit volubilis despecto vitae. Defetiscor auxilium xiphias vel vulgaris bene.,Entrada,86.40120925839126,https://loremflickr.com/2997/3727/food?lock=828141526121400,clam,aqua,turbo,,,,,,601,12,74,57,vegano,sem glúten,true,false,28.6850480598473,2025-11-21T23:56:56.043Z,true,17,4.40880917043253,169,2024-07-08T18:40:42.922Z,2025-05-29T03:32:11.785Z,,,
683d8d05c709d34c0311e5dc,683d8d05c709d34c0311e485,683d8d05c709d34c0311e4b7,Bespoke Gold Car,Quis adamo ceno arx dolorum cernuus adulatio defaeco. Collum tego vero totam condico alter ait. Desolo cupressus audentia vorago vere adipisci canonicus verbera comptus volaticus.,Sobremesa,31.02227249510149,https://loremflickr.com/1224/618/food?lock=3772409054290468,adopto,debitis,titulus,,,,,,367,39,42,76,vegano,,false,false,12.16074904101432,2025-10-12T10:15:31.184Z,true,25,2.730976803046839,0,2024-11-19T09:31:53.068Z,2025-03-04T05:20:39.448Z,,,
683d8d05c709d34c0311e5e0,683d8d05c709d34c0311e485,683d8d05c709d34c0311e4b7,Handcrafted Ceramic Bacon,Adduco culpa adflicto theologus ambitus ancilla corroboro tonsor. Tamisium deduco occaecati tabernus teneo maxime talis. Tergiversatio pel vir comptus.,Entrada,29.290696348953322,https://loremflickr.com/2857/2422/food?lock=2549978452944294,tantillus,nobis,abstergo,cotidie,pauci,architecto,tepesco,,684,20,18,34,vegetariano,,false,false,112.3683558712752,2025-07-15T02:50:15.986Z,true,45,2.260156236198312,153,2024-07-18T19:03:54.727Z,2025-03-20T12:14:35.142Z,soja,ovos,amendoim
683d8d05c709d34c0311e5e4,683d8d05c709d34c0311e486,683d8d05c709d34c0311e4b8,Handmade Metal Salad,Aestus colo debeo cervus tum ipsum aestus admitto. Surgo delego caecus defessus. Arbor cenaculum infit doloribus verbum.,Bebida,42.79954272032221,https://loremflickr.com/904/2583/food?lock=4322762452732479,cibus,solium,adinventitias,enim,,,,,489,52,150,30,,,false,false,101.94917181092987,2025-11-02T23:13:36.581Z,true,30,3.070096949216922,220,2025-03-20T03:48:01.521Z,2025-03-30T12:57:37.520Z,ovos,frutos do mar,
683d8d05c709d34c0311e5e6,683d8d05c709d34c0311e486,683d8d05c709d34c0311e4b8,Small Cotton Pizza,Occaecati utrimque verus vilis conor curvo delibero turba decet. Degenero cicuta acies. Ater umerus suscipio correptius vel unde armarium sordeo auctor.,Prato Principal,36.00563687746585,https://loremflickr.com/632/3205/food?lock=7568365866123192,cognomen,vir,dolore,vacuus,quo,clibanus,,,1076,13,12,59,sem glúten,,false,false,24.336265015476293,2025-09-03T13:16:02.107Z,false,19,2.033156756762782,158,2024-07-03T21:55:22.206Z,2025-03-22T20:30:42.782Z,soja,,
683d8d05c709d34c0311e5eb,683d8d05c709d34c0311e486,683d8d05c709d34c0311e4b8,Awesome Rubber Bacon,Architecto venia ago vinitor turpis veniam. Conscendo curtus depromo cenaculum dens reprehenderit. Vere vito depopulo aperio ventus carcer totidem in.,Acompanhamento,98.63729841402065,https://loremflickr.com/2606/425/food?lock=8371225689977884,iusto,unus,ultra,cresco,currus,thermae,cibo,,693,11,105,15,vegano,sem glúten,false,false,11.084766923952467,2025-07-06T08:37:11.347Z,true,22,3.8324342405769256,179,2025-04-23T22:55:26.341Z,2025-03-23T17:35:54.716Z,,,
683d8d05c709d34c0311e5ed,683d8d05c709d34c0311e486,683d8d05c709d34c0311e4b8,Soft Aluminum Chips,Cavus auctus vir vindico annus. Ait cornu nesciunt. Allatus non dedico traho ipsam amplexus.,Bebida,53.674366921988536,https://loremflickr.com/3165/159/food?lock=8237685716463687,tantum,considero,vesper,,,,,,807,50,131,71,,,false,false,118.45169121650028,2025-09-26T13:49:05.200Z,true,32,3.1619467857378396,273,2024-01-07T22:36:56.573Z,2025-02-25T19:05:26.642Z,,,
683d8d05c709d34c0311e5f9,683d8d05c709d34c0311e487,683d8d05c709d34c0311e4b9,Gorgeous Steel Tuna,Tui varius supellex bene condico curis error corona adhuc. Adsidue pecto umerus conor suffoco ascisco tergum valeo. Tunc astrum decerno derelinquo cultellus conicio creber quos sollers.,Acompanhamento,135.1459326308219,https://loremflickr.com/2175/2685/food?lock=2843510415803203,theatrum,utrimque,est,terra,assentator,vulgaris,cura,creta,238,80,13,23,,,false,false,37.25303444791409,2025-11-05T04:54:06.693Z,true,33,2.1142567104864187,84,2024-11-21T01:57:21.889Z,2025-04-02T02:52:26.900Z,,,
683d8d05c709d34c0311e5fb,683d8d05c709d34c0311e487,683d8d05c709d34c0311e4b9,Small Cotton Car,Speciosus solum attero comparo amet conventus incidunt concido audax. Stips dicta aeneus cerno voro templum demo video. Tres deputo cohaero apparatus compello strues.,Prato Principal,39.34735064203208,https://loremflickr.com/3126/1526/food?lock=7732573498925172,suppono,carus,aestas,statim,caries,,,,268,47,99,87,sem glúten,vegano,false,false,22.34466331075953,2025-06-27T13:54:42.259Z,true,15,3.935795595033468,26,2023-07-22T01:48:52.552Z,2025-03-01T08:48:26.979Z,glúten,amendoim,lactose
683d8d05c709d34c0311e601,683d8d05c709d34c0311e487,683d8d05c709d34c0311e4b9,Incredible Bronze Cheese,Cibus conatus delicate capitulus. Adsidue aiunt trado somniculosus solio et magni antea terga. Combibo ultra tempore calculus cohors possimus corporis culpo vulticulus.,Acompanhamento,134.1027391563484,https://loremflickr.com/3229/190/food?lock=6924234043043933,voro,veritatis,adversus,cura,,,,,176,68,69,85,vegano,vegetariano,false,false,18.908094139707167,2025-06-21T11:05:02.034Z,true,24,4.951731372285138,178,2025-01-16T21:53:02.772Z,2025-03-08T06:29:03.741Z,,,
683d8d05c709d34c0311e4db,683d8d05c709d34c0311e477,683d8d05c709d34c0311e4a9,Oriental Plastic Table,Apostolus tredecim strenuus carus comparo adhuc vorago. Distinctio cenaculum certe comburo denique. Tribuo volutabrum audacia truculenter crebro.,Bebida,51.58909053673306,https://loremflickr.com/700/3093/food?lock=4558802105683329,nesciunt,truculenter,voco,tamisium,supplanto,quae,calcar,supplanto,351,20,125,82,,,false,false,114.78023215607787,2025-11-12T11:08:14.501Z,false,17,4.4082910636981385,107,2024-09-06T13:06:38.348Z,2025-04-01T12:14:12.040Z,glúten,,
683d8d05c709d34c0311e4dc,683d8d05c709d34c0311e477,683d8d05c709d34c0311e4a9,Frozen Silk Chicken,Conqueror avarus aestas reiciendis. Umerus creptio cetera adduco nobis combibo spiculum crustulum aspernatur amicitia. Alveus blanditiis cernuus thema demum assumenda tremo desparatus earum tamdiu.,Sobremesa,74.84213192369907,https://loremflickr.com/2708/1720/food?lock=7541922370411837,cito,vox,comprehendo,tam,,,,,218,80,122,10,vegetariano,,false,false,105.27400564076525,2025-08-20T09:03:26.112Z,true,32,3.036674933809007,108,2024-10-04T01:14:48.587Z,2025-04-02T20:14:30.225Z,frutos do mar,,
683d8d05c709d34c0311e4dd,683d8d05c709d34c0311e477,683d8d05c709d34c0311e4a9,Ergonomic Marble Keyboard,Ducimus quibusdam tandem crepusculum stipes tero capillus torqueo curis. Speciosus cauda accusamus cado patruus vergo somniculosus studio. Autem tabernus derelinquo spectaculum crudelis.,Prato Principal,48.40389269049372,https://loremflickr.com/3801/3794/food?lock=7264369965190746,sequi,concedo,carbo,votum,distinctio,aliquam,,,932,9,72,29,vegetariano,sem glúten,false,false,27.564775288002153,2025-07-20T00:48:21.954Z,true,25,4.7495135557077255,91,2025-03-19T19:17:09.466Z,2025-05-18T05:47:48.388Z,soja,glúten,ovos
683d8d05c709d34c0311e4de,683d8d05c709d34c0311e477,683d8d05c709d34c0311e4a9,Unbranded Rubber Bacon,Sublime derelinquo averto vindico viriliter canonicus certus. Comitatus provident theatrum decens ceno balbus cura stultus considero. Credo stillicidium tempore adipisci combibo derelinquo pax comedo utrimque.,Prato Principal,74.59231117463997,https://loremflickr.com/728/1474/food?lock=5754228916465996,suffoco,caput,ullam,cernuus,summa,ab,comparo,,944,13,126,77,,,false,false,48.32991683727553,2025-08-30T23:57:01.515Z,true,14,4.548229164085919,4,2023-09-29T01:58:57.046Z,2025-05-17T00:35:35.644Z,glúten,frutos do mar,
683d8d05c709d34c0311e4e7,683d8d05c709d34c0311e478,683d8d05c709d34c0311e4aa,Bespoke Wooden Soap,Stillicidium beatae excepturi culpo benigne volaticus tactus tracto cogito. Tero autem comprehendo depromo depulso admoveo subseco attonbitus tametsi vitiosus. Atqui suffoco vulgivagus illo creator corona delectus ventosus amor.,Prato Principal,96.33571624058933,https://loremflickr.com/920/330/food?lock=7015817043157767,crudelis,corona,delego,villa,atavus,tricesimus,,,542,80,69,52,,,false,false,30.698002339874083,2025-09-17T03:31:29.883Z,true,21,4.014081549168554,271,2023-10-17T16:03:45.658Z,2025-02-25T17:39:32.044Z,amendoim,soja,
683d8d05c709d34c0311e4e9,683d8d05c709d34c0311e478,683d8d05c709d34c0311e4aa,Intelligent Granite Pizza,Aliquam veritas adflicto. Valde neque circumvenio approbo cohaero. Defluo cilicium reiciendis tepesco strenuus benigne comptus.,Entrada,67.96765120507291,https://loremflickr.com/2860/2022/food?lock=4742442847039102,vinco,angustus,uterque,ultra,rerum,,,,470,23,29,56,vegetariano,vegano,false,true,104.48973881176937,2025-10-18T07:21:22.995Z,true,25,3.350991193007732,285,2024-03-24T23:15:36.181Z,2025-02-13T17:39:39.621Z,amendoim,,
683d8d05c709d34c0311e4f1,683d8d05c709d34c0311e478,683d8d05c709d34c0311e4aa,Awesome Plastic Mouse,Aedificium acsi conduco conservo tantillus cariosus strues verto. Accusator tendo bestia occaecati ex. Illum concedo ventosus toties.,Bebida,128.49306707329958,https://loremflickr.com/818/3977/food?lock=3027719276594301,communis,basium,ante,tandem,vitium,,,,824,61,86,89,,,false,false,31.823221164552688,2025-06-30T12:55:26.918Z,true,16,3.7042131287812037,225,2024-04-19T11:57:39.083Z,2025-04-11T01:51:30.998Z,frutos do mar,,
683d8d05c709d34c0311e4f6,683d8d05c709d34c0311e479,683d8d05c709d34c0311e4ab,Refined Cotton Chips,Adversus quisquam arguo viscus tendo tepesco alii celer acidus magnam. Rerum conspergo ubi desidero cado trepide sortitus. Cur suadeo laudantium synagoga vehemens damnatio rem tenuis.,Sobremesa,100.00696976600565,https://loremflickr.com/1987/3000/food?lock=7298063499436841,angustus,certe,acidus,thesaurus,vito,voluptatibus,corona,,562,20,147,6,sem glúten,vegano,false,false,36.8119910304789,2025-07-16T18:30:30.642Z,true,30,4.717720116855278,4,2024-08-28T01:33:57.691Z,2025-05-31T14:26:51.778Z,,,
683d8d05c709d34c0311e4f8,683d8d05c709d34c0311e479,683d8d05c709d34c0311e4ab,Bespoke Marble Hat,Verbum comedo facilis aspicio cras. Cerno odit absens testimonium sono. Utroque assentator culpa cattus urbanus sollers arbor cometes hic adversus.,Prato Principal,87.20968245936972,https://loremflickr.com/1100/3528/food?lock=8318108502214249,thesis,adhaero,vinco,capto,arceo,officia,vir,cervus,306,72,26,27,sem glúten,vegano,false,false,27.706387622090563,2025-07-01T03:37:22.918Z,true,14,2.7999403521065696,134,2024-04-20T19:39:35.211Z,2025-02-08T16:04:40.107Z,lactose,,
683d8d05c709d34c0311e4fc,683d8d05c709d34c0311e479,683d8d05c709d34c0311e4ab,Handcrafted Aluminum Hat,Bonus attollo auditor vel vociferor quibusdam arbor celo voluptatem tristis. Anser ascit tondeo nulla. Vaco verecundia cibo tepidus.,Sobremesa,81.55422754803638,https://loremflickr.com/1547/955/food?lock=6335426693308367,facilis,venustas,copiose,arx,uter,arceo,,,149,49,27,22,vegetariano,vegano,false,false,112.31575235129097,2025-06-22T10:16:54.977Z,true,15,3.132482811278469,238,2023-09-23T06:45:12.089Z,2025-04-07T07:02:29.297Z,glúten,ovos,lactose
683d8d05c709d34c0311e500,683d8d05c709d34c0311e479,683d8d05c709d34c0311e4ab,Bespoke Rubber Pants,Conscendo caritas toties. Supplanto cruentus depereo timor curiositas tumultus virtus cimentarius acer. Tergeo eaque a ancilla aveho crustulum derelinquo ut molestiae eligendi.,Entrada,145.67456681635582,https://loremflickr.com/147/2594/food?lock=4988260893713491,deripio,suus,canis,despecto,voveo,vaco,,,1187,64,127,43,vegetariano,sem glúten,false,true,62.01097557895757,2025-09-25T12:05:00.828Z,true,41,3.9900968370902463,88,2024-01-26T13:58:05.201Z,2025-04-16T14:49:21.817Z,soja,,
