_id,restaurante_id,cardapio_id,nome,descricao,categoria,preco,fotos[0],ingredientes[0],ingredientes[1],ingredientes[2],ingredientes[3],ingredientes[4],ingredientes[5],ingredientes[6],ingredientes[7],informacoes_nutricionais.calorias,informacoes_nutricionais.proteinas,informacoes_nutricionais.carboidratos,informacoes_nutricionais.gorduras,opcoes_dieteticas[0],opcoes_dieteticas[1],destaque,promocao.ativo,promocao.preco_promocional,promocao.validade,disponivel,tempo_preparo,avaliacao_media,total_avaliacoes,data_criacao,ultima_atualizacao,alergenos[0],alergenos[1],alergenos[2]
683d8d06c709d34c0311e7fe,683d8d05c709d34c0311e4a5,683d8d05c709d34c0311e4d7,Soft Bronze Salad,Sequi distinctio curiositas aestas bellicus vester. Desino dolorem alveus demens toties est depulso. Hic vitiosus ventus cibo.,Prato Principal,9.863699871846904,https://loremflickr.com/656/3273/food?lock=4061606443332602,averto,tempus,contra,tepesco,addo,depopulo,baiulus,,903,79,50,78,vegano,,false,false,7.76924276610738,2025-06-21T20:59:51.209Z,true,28,4.317562632750903,144,2025-04-08T05:33:45.357Z,2025-04-30T05:33:04.371Z,lactose,,
683d8d06c709d34c0311e800,683d8d05c709d34c0311e4a6,683d8d05c709d34c0311e4d8,Handmade Wooden Pizza,Depereo sordeo dolorum curo allatus decerno triumphus curriculum. Vir doloribus ocer vis concedo delinquo benevolentia crur. Aeger ustulo tego absorbeo bonus artificiose arbustum trans itaque.,Acompanhamento,129.5894316530864,https://loremflickr.com/1175/176/food?lock=3077525456539078,vestigium,cresco,sumo,sodalitas,,,,,955,53,42,69,,,false,false,85.371435476764,2025-08-26T20:56:35.576Z,true,28,2.1837057461300673,181,2024-10-24T16:08:30.766Z,2025-03-15T23:46:41.023Z,,,
683d8d06c709d34c0311e801,683d8d05c709d34c0311e4a6,683d8d05c709d34c0311e4d8,Oriental Metal Shoes,Spectaculum thymbra adsidue demulceo inflammatio curso. Acquiro uberrime thalassinus amissio cubitum solio pecus caterva alter. Apto atrox aspernatur contra aeternus ustulo confugo acerbitas nemo.,Acompanhamento,120.15634067880605,https://loremflickr.com/2897/741/food?lock=7044321139550619,credo,depraedor,denego,sperno,tergum,,,,869,73,10,66,,,false,false,107.9444054955654,2025-08-07T04:01:21.123Z,true,8,3.6730855997586644,278,2025-03-09T19:14:32.462Z,2025-03-08T22:08:27.805Z,ovos,frutos do mar,glúten
683d8d06c709d34c0311e802,683d8d05c709d34c0311e4a6,683d8d05c709d34c0311e4d8,Bespoke Rubber Salad,Conicio sint advenio derelinquo earum. Advoco ex corroboro adinventitias. Torrens deinde adopto decens una.,Bebida,57.660906952045565,https://loremflickr.com/2348/2882/food?lock=1228854090128039,carcer,comis,articulus,depraedor,aiunt,votum,comitatus,,1054,36,109,10,vegano,vegetariano,false,false,68.31976682340107,2025-11-26T07:33:07.247Z,true,42,3.7235796298096746,29,2024-11-09T09:24:12.639Z,2025-03-31T22:28:03.677Z,soja,,
683d8d06c709d34c0311e803,683d8d05c709d34c0311e4a6,683d8d05c709d34c0311e4d8,Bespoke Granite Chips,Arto solum claro. Congregatio damnatio defungo circumvenio casus subseco speciosus temporibus aeneus territo. Super at tabula thymbra.,Bebida,84.89287815001572,https://loremflickr.com/2946/1635/food?lock=5878243110048335,enim,delectatio,repellendus,cum,calcar,acerbitas,quibusdam,creber,105,20,19,36,vegetariano,vegano,false,false,64.98114979415195,2025-11-04T01:57:37.922Z,true,36,3.876762320041641,219,2024-03-23T23:35:39.002Z,2025-05-04T23:06:35.768Z,lactose,glúten,frutos do mar
683d8d06c709d34c0311e808,683d8d05c709d34c0311e4a6,683d8d05c709d34c0311e4d8,Fantastic Wooden Soap,Thema temptatio voluptatum apostolus speculum accendo voro uredo sto contra. Curto tantum comedo delicate tondeo. Calco coniuratio custodia brevis ager supplanto id colo bestia.,Bebida,130.3150617899908,https://loremflickr.com/399/3943/food?lock=6095323527281057,solum,modi,tubineus,numquam,,,,,357,18,15,85,vegetariano,sem glúten,false,false,108.31728769591024,2025-09-20T19:56:49.460Z,true,22,2.6743655194912064,245,2023-11-26T07:53:13.015Z,2025-05-27T17:05:48.371Z,glúten,frutos do mar,ovos
683d8d06c709d34c0311e80c,683d8d05c709d34c0311e4a6,683d8d05c709d34c0311e4d8,Intelligent Granite Shoes,Tersus depraedor versus. Corona comprehendo conor acidus tempora arca alienus animus defluo cupiditas. Curiositas vos amet claro synagoga terminatio.,Bebida,10.31324561439871,https://loremflickr.com/2001/874/food?lock=7873911451131313,corporis,veritatis,verbum,vigor,succurro,conspergo,,,1194,34,94,44,,,false,false,84.75602601227537,2025-11-07T19:02:34.057Z,true,26,4.154339385228328,97,2023-06-25T10:04:21.304Z,2025-05-01T00:48:47.918Z,amendoim,glúten,
683d8d06c709d34c0311e80e,683d8d05c709d34c0311e4a6,683d8d05c709d34c0311e4d8,Luxurious Marble Pizza,Expedita balbus adflicto amicitia urbs corpus. Deficio voluntarius adipisci magni fuga pectus ab aduro cohaero. Adipiscor coepi asper animadverto.,Bebida,11.876681325740208,https://loremflickr.com/1830/1903/food?lock=3034889009553122,defessus,curtus,alii,volutabrum,crebro,confido,denego,aperte,981,55,79,55,vegetariano,,false,false,33.48177880212422,2025-07-17T21:23:41.342Z,true,13,2.772517353490003,167,2024-02-08T16:49:53.349Z,2025-04-02T15:25:58.198Z,frutos do mar,soja,lactose
683d8d06c709d34c0311e813,683d8d05c709d34c0311e4a7,683d8d05c709d34c0311e4d9,Gorgeous Granite Table,Optio tolero consuasor voluptatibus sollers vae arto aureus. Vir sperno sunt artificiose vulgivagus corrumpo conitor tabula cum distinctio. Bardus summopere bardus.,Sobremesa,58.44153462083681,https://loremflickr.com/3805/3411/food?lock=8820710938299482,adeptio,inventore,quaerat,trucido,paens,contabesco,beneficium,,264,76,61,75,sem glúten,,false,false,51.736993006174636,2025-10-27T17:24:00.578Z,true,21,4.897137197883026,154,2023-12-10T21:04:11.670Z,2025-02-28T15:24:08.513Z,glúten,amendoim,soja
683d8d06c709d34c0311e817,683d8d05c709d34c0311e4a7,683d8d05c709d34c0311e4d9,Fantastic Concrete Cheese,Aestus patria artificiose cur acerbitas cilicium ipsum conor patrocinor. Explicabo amissio voluptatem collum depereo suppono administratio aestivus ipsam deprecator. Caveo censura apparatus distinctio concedo tersus.,Acompanhamento,134.45010803675098,https://loremflickr.com/1858/2571/food?lock=289448829474463,talis,agnosco,inflammatio,,,,,,591,9,67,38,sem glúten,vegetariano,false,false,101.73153046557442,2025-08-12T05:44:35.964Z,true,36,2.049360052717409,255,2025-02-13T09:09:00.762Z,2025-04-23T16:54:18.021Z,soja,,
683d8d06c709d34c0311e824,683d8d05c709d34c0311e4a7,683d8d05c709d34c0311e4d9,Soft Gold Soap,Voluptates cupio vinculum. Vulgo canto amet aut deprecator. Acies admitto cohors.,Acompanhamento,37.333639331601276,https://loremflickr.com/1179/1032/food?lock=4481993247208082,derideo,ambulo,cribro,,,,,,715,19,135,31,sem glúten,vegetariano,false,false,14.600813056756714,2025-08-15T23:13:40.753Z,true,19,2.945681780184334,24,2025-05-29T05:40:00.774Z,2025-02-25T21:53:20.131Z,ovos,,
683d8d06c709d34c0311e828,683d8d05c709d34c0311e4a8,683d8d05c709d34c0311e4da,Bespoke Plastic Pizza,Trepide vomer vindico temeritas ascit tondeo. Arcesso auctor bestia aliqua uterque timor aranea. Argumentum amita reiciendis sto appello distinctio sui bellicus.,Bebida,94.08644709965955,https://loremflickr.com/156/3650/food?lock=8538634891194607,aeger,vesco,natus,ratione,contabesco,consuasor,surculus,,148,74,113,78,,,true,false,40.4343740939004,2025-08-09T07:35:49.762Z,true,29,3.183097902923602,131,2023-07-06T20:04:02.328Z,2025-02-10T01:11:25.396Z,ovos,soja,amendoim
683d8d06c709d34c0311e82a,683d8d05c709d34c0311e4a8,683d8d05c709d34c0311e4da,Incredible Concrete Gloves,Beatus curo verbera canto placeat decipio cohaero ventito. Ara abeo tempore baiulus vindico. Numquam apto capillus.,Entrada,101.42860161289896,https://loremflickr.com/3987/361/food?lock=3769717924566281,agnosco,canonicus,ullam,trans,victus,constans,voro,,452,5,97,81,vegetariano,vegano,false,false,61.725840673044154,2025-08-18T22:38:52.987Z,true,23,3.2147673480677614,172,2023-12-17T06:22:33.719Z,2025-03-06T20:12:36.700Z,,,
683d8d06c709d34c0311e82b,683d8d05c709d34c0311e4a8,683d8d05c709d34c0311e4da,Handcrafted Metal Chair,Cedo inventore tergiversatio paulatim audax derelinquo civitas. Tepidus temptatio creator conduco occaecati adicio tamquam. Maiores crinis molestias cedo viriliter compello.,Sobremesa,92.09754622243982,https://loremflickr.com/2514/1442/food?lock=2391551768943272,cognomen,territo,absque,repellendus,,,,,118,23,99,17,sem glúten,vegetariano,false,false,106.81021827772194,2025-09-04T04:16:24.540Z,true,24,3.1088387917813174,72,2023-12-20T03:52:15.184Z,2025-03-17T10:02:16.326Z,ovos,,
683d8d06c709d34c0311e82d,683d8d05c709d34c0311e4a8,683d8d05c709d34c0311e4da,Luxurious Bamboo Shirt,Deludo sopor provident conscendo. Chirographum sumo vespillo. Ipsum argumentum cur cunae.,Sobremesa,36.91295316623298,https://loremflickr.com/1192/2936/food?lock=2471455222537119,coadunatio,vulariter,desparatus,labore,dolor,temeritas,aureus,,836,9,111,23,vegano,,false,true,19.077712267215407,2025-10-09T11:03:19.241Z,true,20,2.373630255635897,136,2024-03-31T11:19:57.747Z,2025-02-28T09:07:47.516Z,lactose,,
683d8d06c709d34c0311e82f,683d8d05c709d34c0311e4a8,683d8d05c709d34c0311e4da,Handmade Silk Mouse,Cribro commodi temperantia nihil assentator complectus depulso derideo ustulo vulgus. Ultra aestus doloremque amissio vilicus coniuratio cohors amet confugo. Admitto est tollo adstringo maiores universe deprecator similique tonsor.,Entrada,37.424186675885316,https://loremflickr.com/2321/2595/food?lock=4772817409864771,deputo,sol,denique,attonbitus,sursum,substantia,,,751,8,33,12,,,true,false,86.2570684292799,2025-06-14T01:11:42.493Z,false,31,4.59034667596549,244,2024-08-14T18:17:52.963Z,2025-02-13T03:50:05.783Z,glúten,ovos,
683d8d05c709d34c0311e72e,683d8d05c709d34c0311e498,683d8d05c709d34c0311e4ca,Recycled Bamboo Gloves,Patruus adsidue territo suus aliquam peccatus. Vulgivagus tersus caterva temptatio. Currus quisquam talus acervus tametsi.,Entrada,128.0856444397274,https://loremflickr.com/2933/1213/food?lock=1285466368521203,cubo,capitulus,varietas,clarus,creator,campana,,,1144,37,50,19,vegetariano,vegano,false,false,19.029647987250367,2025-08-28T02:21:34.133Z,true,17,2.2636201453528204,156,2023-12-23T01:27:41.809Z,2025-04-08T22:33:03.955Z,,,
683d8d05c709d34c0311e72f,683d8d05c709d34c0311e498,683d8d05c709d34c0311e4ca,Fresh Bamboo Chips,Esse ager corporis. Sol cognatus cernuus audacia ulciscor substantia defluo iure solum odio. Deleo correptius validus cura fugit conspergo eos decretum.,Sobremesa,105.3555742228786,https://loremflickr.com/850/1891/food?lock=927428299247038,deserunt,talio,charisma,decipio,depono,varius,,,648,64,89,31,,,true,false,20.7194223395606,2025-08-28T17:05:38.126Z,true,38,3.350382205102903,87,2023-12-14T21:55:03.867Z,2025-03-09T09:20:36.289Z,amendoim,soja,lactose
683d8d05c709d34c0311e735,683d8d05c709d34c0311e498,683d8d05c709d34c0311e4ca,Fantastic Silk Table,Astrum aeneus tumultus audeo suscipio bibo. Accedo cubicularis adhaero sollicito video antea vesco undique abutor certus. Infit capillus suppono tersus varius suffoco cupio.,Prato Principal,7.548406672484772,https://loremflickr.com/61/238/food?lock=3524880669395012,spargo,sit,attonbitus,trucido,umerus,consuasor,,,635,50,150,87,vegano,,false,false,96.66367437089163,2025-11-12T04:08:58.117Z,true,14,4.194336951937274,33,2025-05-23T08:32:11.177Z,2025-03-21T09:14:45.175Z,,,
683d8d05c709d34c0311e73b,683d8d05c709d34c0311e498,683d8d05c709d34c0311e4ca,Frozen Rubber Pants,Voluptates curo cuppedia aperiam asper ulciscor adsuesco blandior annus a. Unus arceo stultus venustas solus copiose ancilla summisse voluptate aeger. Suscipit somniculosus toties.,Entrada,14.419102566848098,https://loremflickr.com/330/2136/food?lock=8184713380852946,temeritas,desino,tantum,aspicio,vitium,ea,solvo,,1103,61,132,27,vegetariano,vegano,false,false,56.367048599328996,2025-10-30T16:39:36.408Z,true,41,2.0921929757523077,160,2023-12-16T00:14:19.751Z,2025-02-12T06:22:39.300Z,frutos do mar,,
683d8d05c709d34c0311e73e,683d8d05c709d34c0311e498,683d8d05c709d34c0311e4ca,Sleek Gold Cheese,Cognomen alii currus porro aurum defaeco. Cubo cena succedo veritatis recusandae circumvenio aro iusto. Tui conservo vulpes fuga celer ut adsum patria.,Acompanhamento,44.383484529878025,https://loremflickr.com/1236/659/food?lock=8817468756089826,calco,thermae,adulescens,sponte,cunabula,vacuus,sollicito,assentator,834,44,110,23,vegano,,true,false,107.93009939451339,2025-06-25T02:17:52.017Z,true,20,2.6477941232184494,19,2024-01-05T16:12:33.229Z,2025-05-01T00:32:55.434Z,soja,ovos,
683d8d05c709d34c0311e744,683d8d05c709d34c0311e499,683d8d05c709d34c0311e4cb,Generic Plastic Shirt,Quasi tumultus tripudio aduro. Absorbeo apparatus corrupti studio adstringo tandem cenaculum. Adduco cibus tero vesper.,Sobremesa,23.744010969770454,https://loremflickr.com/1584/39/food?lock=3307587680920819,vivo,taedium,subvenio,comis,,,,,892,19,136,66,,,true,true,111.55924096826388,2025-10-05T12:41:32.259Z,true,31,4.817794828410483,60,2024-12-25T00:50:24.097Z,2025-04-07T18:43:42.716Z,,,
683d8d05c709d34c0311e745,683d8d05c709d34c0311e499,683d8d05c709d34c0311e4cb,Refined Rubber Mouse,Spiculum vester adipiscor vaco vesica admoveo tabesco. Conicio pauper ciminatio suffoco utrum adulatio alienus coadunatio. Aequus ambitus thymbra curatio complectus cuius.,Entrada,29.56464220144562,https://loremflickr.com/2049/3813/food?lock=1985462726889899,libero,sint,alius,catena,laboriosam,cena,,,783,25,129,14,sem glúten,vegetariano,false,false,73.62548645338356,2025-12-01T20:40:51.580Z,true,34,4.539625102822894,246,2024-02-27T20:03:23.836Z,2025-05-07T06:09:15.952Z,frutos do mar,lactose,
683d8d05c709d34c0311e748,683d8d05c709d34c0311e499,683d8d05c709d34c0311e4cb,Electronic Silk Cheese,Avarus toties cauda coruscus consequatur adfero vetus addo. Voluptatum aegre creator. Adicio curatio terra vulticulus.,Prato Principal,46.72520769629302,https://loremflickr.com/1492/856/food?lock=6556520440059283,dolorem,casso,umerus,quia,caries,,,,583,63,80,10,sem glúten,,false,false,36.33136181772459,2025-07-31T22:43:29.624Z,true,18,3.9409007043227313,48,2024-11-28T00:38:13.816Z,2025-02-05T09:13:27.552Z,amendoim,ovos,
683d8d05c709d34c0311e74e,683d8d05c709d34c0311e499,683d8d05c709d34c0311e4cb,Sleek Granite Fish,Cornu via suscipio thesaurus suus. Acies varietas adsum solio. Maxime crapula vir deficio cado.,Acompanhamento,60.362483323339895,https://loremflickr.com/2441/2114/food?lock=4998615957752009,tantillus,super,sint,cunae,,,,,253,74,142,44,sem glúten,vegetariano,false,false,88.01598562019603,2025-09-05T11:06:52.488Z,true,17,2.9676260190786636,198,2024-06-18T19:24:34.353Z,2025-02-13T23:50:04.752Z,ovos,,
683d8d05c709d34c0311e750,683d8d05c709d34c0311e499,683d8d05c709d34c0311e4cb,Handcrafted Plastic Cheese,Acies sunt victoria. Canonicus sponte aureus. Vulariter pax minima creta vilis civitas nulla cotidie labore testimonium.,Acompanhamento,7.604100907427287,https://loremflickr.com/431/638/food?lock=2329387916827104,tepidus,quaerat,correptius,absum,,,,,280,62,46,70,,,false,true,17.57801657972619,2025-11-02T05:47:41.282Z,true,42,4.753795099358766,5,2023-07-22T17:26:46.880Z,2025-05-21T13:07:33.977Z,amendoim,,
683d8d05c709d34c0311e754,683d8d05c709d34c0311e49a,683d8d05c709d34c0311e4cc,Unbranded Gold Salad,Spero deduco tabella canto cervus tamdiu vomito accusator sufficio accommodo. Sodalitas benevolentia ager vilitas. Demum vulariter vilitas amissio capillus totus.,Bebida,128.887201354474,https://loremflickr.com/1267/1262/food?lock=7610272813814529,tantum,volup,charisma,cupiditas,ad,,,,1075,77,31,47,,,false,false,50.28623897080838,2025-08-22T04:41:27.624Z,true,14,4.759349700952877,25,2023-11-29T06:59:28.939Z,2025-03-27T11:36:57.344Z,soja,frutos do mar,
683d8d05c709d34c0311e757,683d8d05c709d34c0311e49a,683d8d05c709d34c0311e4cc,Refined Gold Towels,Tondeo voluptates sublime averto ager perspiciatis. Beatus atqui video comburo. Ara curto complectus cotidie arx.,Acompanhamento,145.1287133698428,https://loremflickr.com/313/49/food?lock=4998755890106025,pel,consequuntur,delinquo,vociferor,convoco,doloribus,,,233,27,149,39,sem glúten,,false,false,117.64088204468213,2025-07-11T14:53:24.884Z,true,34,3.145397393022327,198,2023-07-14T23:02:14.177Z,2025-02-09T02:40:56.852Z,,,
683d8d05c709d34c0311e75a,683d8d05c709d34c0311e49a,683d8d05c709d34c0311e4cc,Rustic Cotton Fish,Bellum derideo verus tenax tametsi usus virtus dedecor. Vitiosus deinde crastinus canis bene. Aliquid animadverto suscipio.,Acompanhamento,108.0221242600473,https://loremflickr.com/3512/538/food?lock=2525101781923158,vilis,abstergo,bellicus,valens,,,,,141,47,67,16,sem glúten,,false,false,17.071793555725723,2025-06-13T00:34:06.088Z,true,11,3.2393321865675273,17,2023-07-09T14:08:26.024Z,2025-05-01T19:10:09.649Z,ovos,glúten,soja
683d8d05c709d34c0311e75e,683d8d05c709d34c0311e49b,683d8d05c709d34c0311e4cd,Bespoke Bronze Soap,Vita cimentarius degusto subseco vorax. Eius administratio occaecati complectus aestus contra auctus provident votum. Conor eligendi itaque terga cohors bene crebro curso corporis.,Acompanhamento,29.404757357852468,https://loremflickr.com/3173/2882/food?lock=5287368335403734,terminatio,socius,chirographum,,,,,,1157,57,43,56,sem glúten,vegano,false,false,9.464114517823484,2025-10-15T12:19:57.966Z,true,9,4.849744973655435,212,2025-04-17T04:11:07.640Z,2025-02-04T00:35:39.614Z,amendoim,,
683d8d05c709d34c0311e761,683d8d05c709d34c0311e49b,683d8d05c709d34c0311e4cd,Awesome Rubber Salad,Custodia thema civitas venio carpo. Vos somniculosus vae ceno complectus convoco dedico. Dolorum voluptatibus vigilo torrens voro alius tantum.,Bebida,20.744943650277975,https://loremflickr.com/673/2008/food?lock=7413974176218686,vilis,cogito,ater,considero,averto,pecco,condico,,583,25,49,56,,,false,false,18.177084818958686,2025-07-04T00:08:51.580Z,true,18,4.23301781414024,53,2023-10-16T06:10:49.337Z,2025-04-22T01:03:36.774Z,,,
683d8d05c709d34c0311e762,683d8d05c709d34c0311e49b,683d8d05c709d34c0311e4cd,Generic Gold Tuna,Autem amiculum assentator. Adficio audentia acidus desparatus vicissitudo strues eum. Tres claustrum terreo.,Acompanhamento,142.36388023466614,https://loremflickr.com/2601/3677/food?lock=5606450137932213,somniculosus,voco,temperantia,acidus,,,,,902,28,111,85,vegano,,false,false,61.603103726006296,2025-11-23T07:17:24.860Z,true,15,4.229497635107736,137,2024-09-11T12:42:06.859Z,2025-02-03T15:22:55.728Z,ovos,frutos do mar,lactose
683d8d05c709d34c0311e766,683d8d05c709d34c0311e49b,683d8d05c709d34c0311e4cd,Practical Bamboo Salad,Cruciamentum varietas mollitia aliqua voveo paulatim. Id earum curia delicate. Casso solitudo caelestis.,Sobremesa,138.1620630386897,https://loremflickr.com/312/51/food?lock=6108408514017693,autem,volutabrum,itaque,cogito,autem,,,,700,48,148,17,,,false,false,54.05067342849805,2025-08-08T02:05:41.294Z,true,32,4.118530887011002,195,2023-09-02T06:04:39.607Z,2025-04-08T20:46:24.714Z,soja,,
683d8d05c709d34c0311e76c,683d8d05c709d34c0311e49c,683d8d05c709d34c0311e4ce,Modern Bronze Pants,Absens utilis aufero eius defetiscor defessus. Expedita deserunt triduana quam alius dapifer sodalitas sed pauci eum. Deinde trado summisse averto pecto totus aurum articulus demo.,Entrada,102.71392710246609,https://loremflickr.com/976/1052/food?lock=2614889600095920,voluptate,vinco,templum,succedo,argumentum,desparatus,assumenda,cariosus,454,13,23,15,,,false,false,95.67108504047269,2025-09-26T05:39:00.970Z,true,45,2.9528199093936793,275,2023-12-02T02:59:05.984Z,2025-02-15T00:52:32.336Z,soja,,
683d8d05c709d34c0311e770,683d8d05c709d34c0311e49c,683d8d05c709d34c0311e4ce,Fantastic Concrete Bacon,Deficio asperiores socius voluptate spiculum cupio pecto suppono tam volubilis. Colo sunt solvo. Sustineo terror quo utor animadverto accusantium ventosus.,Sobremesa,95.09775227905632,https://loremflickr.com/2625/213/food?lock=1823324473303622,administratio,alter,paulatim,chirographum,aduro,vesica,,,314,42,77,86,vegano,sem glúten,false,false,108.11895075860728,2025-09-09T01:27:56.893Z,true,20,3.5438935788325505,201,2024-03-22T02:53:20.563Z,2025-03-25T19:14:33.424Z,frutos do mar,lactose,
683d8d05c709d34c0311e772,683d8d05c709d34c0311e49c,683d8d05c709d34c0311e4ce,Small Marble Car,Nisi dolorum conculco. Sustineo abstergo ambulo tandem brevis aperte. Consequuntur iure curvo comptus stipes.,Sobremesa,97.1755576426081,https://loremflickr.com/511/3070/food?lock=6581662392380074,coruscus,admiratio,deleniti,antiquus,tutis,antepono,praesentium,,722,28,75,73,sem glúten,,false,false,109.01087990035506,2025-11-16T09:47:36.241Z,true,22,3.0172682326330444,36,2024-04-19T01:09:40.569Z,2025-04-04T01:24:35.685Z,soja,,
683d8d05c709d34c0311e773,683d8d05c709d34c0311e49c,683d8d05c709d34c0311e4ce,Sleek Wooden Computer,Aeger tyrannus cresco quod sapiente tabula audacia defessus. Adhuc aut quas turbo suasoria animadverto thema. Beatae labore vereor spargo.,Prato Principal,54.47121396400059,https://loremflickr.com/2631/2560/food?lock=2752337781653306,clementia,rem,tempora,vorago,cohibeo,comitatus,,,1178,40,147,49,vegano,sem glúten,false,false,77.77817895770846,2025-08-13T05:56:26.348Z,true,41,2.5510077006551133,218,2024-06-29T13:59:57.639Z,2025-05-23T09:31:30.180Z,glúten,,
683d8d05c709d34c0311e775,683d8d05c709d34c0311e49c,683d8d05c709d34c0311e4ce,Unbranded Cotton Table,Depopulo caute canto cibo. Tandem vinitor ventus cras tum. Admiratio autus angulus capto desino rem ars.,Entrada,31.81159734657653,https://loremflickr.com/1109/2660/food?lock=7223622109929523,fugit,amet,alius,amor,arx,tergum,talis,,270,57,30,6,vegetariano,,true,false,14.389512258271465,2025-07-05T04:29:19.074Z,true,35,3.459163021484219,139,2023-10-26T18:06:07.450Z,2025-03-30T12:33:57.485Z,frutos do mar,amendoim,glúten
683d8d05c709d34c0311e776,683d8d05c709d34c0311e49d,683d8d05c709d34c0311e4cf,Incredible Marble Soap,Clamo vesica defleo aegrus labore totus ducimus villa. Auditor voveo convoco villa consectetur. Vilicus aliquam expedita veritas impedit vapulus.,Entrada,29.69514520353996,https://loremflickr.com/2866/3124/food?lock=4254260022334802,adsidue,dicta,ademptio,unde,cernuus,somniculosus,,,139,24,79,22,vegetariano,sem glúten,false,false,103.39520290140045,2025-09-09T09:22:06.751Z,true,42,4.87239234548103,109,2024-06-22T17:25:55.487Z,2025-03-17T17:58:11.310Z,,,
683d8d05c709d34c0311e77a,683d8d05c709d34c0311e49d,683d8d05c709d34c0311e4cf,Fantastic Wooden Chicken,Summa degenero summa congregatio vomer cursim. Acervus ademptio consuasor debilito aedificium ventosus cunabula despecto cohors velut. Vapulus deleo explicabo tepidus.,Sobremesa,80.0354531295834,https://loremflickr.com/444/2412/food?lock=2598056350023368,cruciamentum,articulus,aureus,deputo,sopor,,,,501,8,94,39,vegano,,false,false,110.5038403352656,2025-09-21T10:52:18.643Z,true,20,3.280982297364847,194,2024-04-05T12:49:32.884Z,2025-02-21T06:25:32.207Z,amendoim,frutos do mar,
683d8d05c709d34c0311e77f,683d8d05c709d34c0311e49d,683d8d05c709d34c0311e4cf,Handcrafted Granite Table,Spargo umquam tandem eligendi veritas aedificium carmen angelus ubi. Talis solus vigor libero amita cui trado sit centum. Aveho textus curvo.,Sobremesa,34.64636070248193,https://loremflickr.com/2459/2801/food?lock=5361970497869387,vindico,universe,urbs,depopulo,conspergo,dolor,vilicus,,1073,69,146,88,vegano,,false,false,85.77849838992564,2025-10-10T12:12:02.529Z,true,37,2.880302537042966,26,2024-08-22T14:10:18.294Z,2025-05-12T07:01:24.347Z,lactose,glúten,
683d8d05c709d34c0311e783,683d8d05c709d34c0311e49d,683d8d05c709d34c0311e4cf,Gorgeous Concrete Keyboard,Verbum demo amplitudo vulariter strues. Conduco aestus optio aptus claro. Adipiscor veniam officiis.,Sobremesa,83.4324639880252,https://loremflickr.com/2378/1392/food?lock=2547416902793013,acidus,laudantium,sumo,adamo,,,,,1015,16,19,59,,,false,false,21.46196355537958,2025-07-27T13:18:39.496Z,true,28,2.432217695619139,73,2025-05-10T23:43:26.943Z,2025-04-28T10:23:56.315Z,soja,,
683d8d05c709d34c0311e787,683d8d05c709d34c0311e49e,683d8d05c709d34c0311e4d0,Small Rubber Mouse,Nulla tolero pecto venio compono vaco. Verumtamen acies colligo. Alveus cuius alii contra capitulus carpo accedo sophismata eveniet nesciunt.,Prato Principal,7.6655203735029085,https://loremflickr.com/559/3251/food?lock=4959995101100785,officiis,viriliter,cubitum,defluo,territo,,,,680,33,88,40,sem glúten,,false,false,20.539009761145294,2025-11-15T17:26:58.438Z,true,42,4.413157335864425,162,2023-10-27T23:59:38.008Z,2025-03-17T21:51:59.377Z,,,
683d8d05c709d34c0311e78a,683d8d05c709d34c0311e49e,683d8d05c709d34c0311e4d0,Incredible Metal Salad,Cenaculum vomica vociferor apparatus amo trado arguo. Perferendis aestus vigor aut altus voluptatibus tergeo sollers ter animi. Laboriosam adsidue adeptio vehemens arbitro ad quis quod.,Sobremesa,126.85014361728999,https://loremflickr.com/1704/2629/food?lock=1760987877979163,terminatio,neque,cupressus,maiores,,,,,830,49,15,74,vegetariano,,false,true,105.69409280068353,2025-10-09T05:20:38.087Z,true,35,4.672316542346522,50,2023-10-03T16:42:07.133Z,2025-02-22T15:08:17.931Z,ovos,frutos do mar,
683d8d05c709d34c0311e790,683d8d05c709d34c0311e49e,683d8d05c709d34c0311e4d0,Handcrafted Bamboo Bacon,Antea contego vergo adfero argentum causa. Aperio comburo sufficio thema varietas decet conforto ambulo repellendus. Stultus vulariter uterque acervus coerceo video hic cicuta.,Prato Principal,20.484932142486535,https://loremflickr.com/3713/2796/food?lock=7458492627987923,alter,arbor,testimonium,casso,cenaculum,cenaculum,vindico,,1023,41,29,23,,,false,true,103.81652908761038,2025-10-20T06:54:54.515Z,true,36,4.4845031234346155,47,2023-10-08T21:43:51.370Z,2025-05-16T09:43:20.413Z,,,
